<?xml version="1.0" encoding="UTF-8"?>
<!--
To change this license header, choose License Headers in Project Properties.
To change this template file, choose Tools | Templates
\and open the template in the editor.
-->


<Merkadona
    xmlns:xsi='http://www.w3.org/2001/XMLSchema-instance'
    xsi:noNamespaceSchemaLocation='Merkadona.xsd'>
    <Empleados>
        <Empleado>
            <ID>2834</ID>
            <Nombre>Maria</Nombre>
            <Reponedora>
                <TotalNumProds>150</TotalNumProds>
            </Reponedora>
            <Cajera>
                <PrecioTotal>20</PrecioTotal>
            </Cajera>
        </Empleado>
    </Empleados>
    <Productos>
        <CantidadEnStock>150</CantidadEnStock>
        <PrecioBase>30</PrecioBase>
        <Nombre>Platano</Nombre>
        <Perecederos>
            <FechaCaducidad>1908/12/12</FechaCaducidad>
        </Perecederos>
    </Productos>

</Merkadona>
